{
  "entity_id": "90000000-0000-4000-8000-000000000001",
  "organization_id": "90000000-0000-4000-8000-000000000002",
  "project_id": "90000000-0000-4000-8000-000000000003",
  "classification": "internal",
  "entity_type": "synthetic.dataset_revision",
  "reference": {
    "kind": "revision",
    "type": "synthetic.dataset_revision",
    "id": "90000000-0000-4000-8000-000000000004",
    "sha256": "aaaaaaaaaaaaaaaaaaaaaaaaaaaaaaaaaaaaaaaaaaaaaaaaaaaaaaaaaaaaaaaa"
  },
  "generation_requirement": "primary",
  "generation_activity_id": "90000000-0000-4000-8000-000000000005",
  "created_at": "2026-07-13T00:00:00Z",
  "recorded_at": "2026-07-13T00:00:00Z",
  "recorded_by": "90000000-0000-4000-8000-000000000006",
  "completeness": {"state": "complete", "issues": []},
  "links": {
    "self": "/api/v1/provenance/entities/90000000-0000-4000-8000-000000000001"
  }
}
